{
  "schema": "low_speed_validation_report",
  "schema_version": "1.1.0",
  "status": "passed",
  "score": 1.0,
  "summary": {
    "blocking_errors": 0,
    "warnings": 0,
    "nodes": 3,
    "paths": 2,
    "edges": 2,
    "waypoints": 6,
    "areas": 1,
    "parking_points": 1
  },
  "items": []
}